{
  "generatedAt": "2026-03-18T12:00:00.000Z",
  "source": "coasttocoastreviews.com",
  "totalReviews": 3,
  "reviews": [
    {
      "title": "The Glass Menagerie",
      "slug": "the-glass-menagerie",
      "url": "https://coasttocoastreviews.com/reviews/the-glass-menagerie",
      "author": "Staff Reviewer",
      "publishedAt": "2026-03-18",
      "rating": "A",
      "ratingNumeric": 4,
      "excerpt": "A luminous revival that honors the original while finding fresh emotional resonance.",
      "imageUrl": "https://coasttocoastreviews.com/images/the-glass-menagerie.jpg",
      "imageWidth": 800,
      "imageHeight": 450
    },
    {
      "title": "Death of a Salesman",
      "slug": "death-of-a-salesman",
      "url": "https://coasttocoastreviews.com/reviews/death-of-a-salesman",
      "author": "Staff Reviewer",
      "publishedAt": "2026-03-18",
      "rating": "B+",
      "ratingNumeric": 3.3,
      "excerpt": "A gripping production with a towering central performance, though the pacing lags in Act II.",
      "imageUrl": "https://coasttocoastreviews.com/images/death-of-a-salesman.jpg",
      "imageWidth": 800,
      "imageHeight": 450
    },
    {
      "title": "Waiting for Godot",
      "slug": "waiting-for-godot",
      "url": "https://coasttocoastreviews.com/reviews/waiting-for-godot",
      "author": "Staff Reviewer",
      "publishedAt": "2026-03-18",
      "rating": "C",
      "ratingNumeric": 2,
      "excerpt": "The existential dread is palpable, but this staging fails to unlock Beckett's dark humor.",
      "imageUrl": "https://coasttocoastreviews.com/images/waiting-for-godot.jpg",
      "imageWidth": 800,
      "imageHeight": 450
    }
  ]
}
